{
  "schemaVersion": "1.0",
  "meta": {
    "variant": "improved",
    "locale": "en-US",
    "pageSize": null,
    "layout": "classic",
    "stage": "student",
    "target": {
      "role": "Marketing Analytics Intern",
      "company": null
    },
    "addressed": [],
    "cuts": [
      {
        "ref": "R14",
        "reason": "The panel could not see how the 300% was measured, so it stays off until you can explain it."
      }
    ]
  },
  "basics": {
    "name": "Riley Castellano",
    "headline": "Business Analytics Student",
    "location": "Columbus, OH",
    "email": "riley.castellano@example.com",
    "phone": "(555) 010-0147",
    "links": [
      {
        "label": "LinkedIn",
        "url": "linkedin.com/in/riley-castellano-example"
      }
    ]
  },
  "sections": [
    {
      "id": "education",
      "type": "education",
      "title": "Education",
      "items": [
        {
          "id": "edu1",
          "school": "Lakeshore State University",
          "location": "Columbus, OH",
          "degree": "Bachelor of Science",
          "field": "Business Analytics",
          "minor": "Marketing",
          "end": "2027-05",
          "endLabel": "Expected",
          "gpa": "3.6/4.0",
          "honors": [
            "Dean's List (3 semesters)"
          ],
          "coursework": [
            "Intro to SQL",
            "Statistics for Business",
            "Marketing Research",
            "Data Visualization"
          ],
          "evidence": [
            {
              "src": "orig",
              "ref": "R4-R7"
            }
          ]
        }
      ]
    },
    {
      "id": "projects",
      "type": "projects",
      "title": "Projects",
      "items": [
        {
          "id": "proj1",
          "name": "Campus Bike Share Survey",
          "context": "Marketing Research class project, team of 4",
          "start": "2025-01",
          "end": "2025-05",
          "evidence": [
            {
              "src": "orig",
              "ref": "R21-R22"
            }
          ],
          "bullets": [
            {
              "id": "proj1.b1",
              "text": "Designed a 12-question survey with 3 classmates and collected 140 responses",
              "evidence": [
                {
                  "src": "orig",
                  "ref": "R23",
                  "quote": "Designed a 12 question survey with 3 classmates and collected 140 responses"
                }
              ],
              "ops": [
                "STANDARDIZE"
              ]
            },
            {
              "id": "proj1.b2",
              "text": "Analyzed the results in Excel with pivot tables and presented a pricing recommendation",
              "evidence": [
                {
                  "src": "orig",
                  "ref": "R24",
                  "quote": "Analyzed the results in Excel with pivot tables and presented a pricing recommendation"
                }
              ],
              "ops": []
            }
          ]
        }
      ]
    },
    {
      "id": "experience",
      "type": "experience",
      "title": "Experience",
      "items": [
        {
          "id": "exp1",
          "org": "Tallgrass Outfitters",
          "role": "Marketing Intern",
          "location": "Columbus, OH",
          "start": "2025-06",
          "end": "2025-08",
          "evidence": [
            {
              "src": "orig",
              "ref": "R9-R10"
            }
          ],
          "bullets": [
            {
              "id": "exp1.b1",
              "text": "Pulled weekly sales numbers into Excel for the Monday team meeting",
              "evidence": [
                {
                  "src": "orig",
                  "ref": "R13",
                  "quote": "Pulled weekly sales numbers into Excel for the Monday team meeting"
                }
              ],
              "ops": [
                "REORDER"
              ]
            },
            {
              "id": "exp1.b2",
              "text": "Ran the weekly email newsletter for about 600 subscribers",
              "evidence": [
                {
                  "src": "orig",
                  "ref": "R11",
                  "quote": "Responsible for the weekly email newsletter to about 600 subscribers"
                }
              ],
              "ops": [
                "REPHRASE"
              ]
            },
            {
              "id": "exp1.b3",
              "text": "Helped with Instagram posts 3x a week and tracked likes in a spreadsheet",
              "evidence": [
                {
                  "src": "orig",
                  "ref": "R12",
                  "quote": "Helped with Instagram posts 3x a week and tracked likes in a spreadsheet"
                }
              ],
              "ops": []
            }
          ]
        },
        {
          "id": "exp2",
          "org": "Cedar Hollow Market",
          "role": "Shift Lead",
          "location": "Columbus, OH",
          "start": "2023-09",
          "end": "present",
          "evidence": [
            {
              "src": "orig",
              "ref": "R15-R16"
            }
          ],
          "bullets": [
            {
              "id": "exp2.b1",
              "text": "Trained 4 new cashiers on the register and the opening checklist",
              "evidence": [
                {
                  "src": "orig",
                  "ref": "R17",
                  "quote": "Trained 4 new cashiers on the register and the opening checklist"
                }
              ],
              "ops": []
            },
            {
              "id": "exp2.b2",
              "text": "Handle closing cash counts and customer questions at the service desk while working about 18 hours a week during the semester",
              "evidence": [
                {
                  "src": "orig",
                  "ref": "R18",
                  "quote": "Handle closing cash counts and customer questions at the service desk"
                },
                {
                  "src": "orig",
                  "ref": "R19",
                  "quote": "Work about 18 hours a week during the semester"
                }
              ],
              "ops": [
                "MERGE"
              ]
            }
          ]
        }
      ]
    },
    {
      "id": "activities",
      "type": "experience",
      "title": "Leadership & Activities",
      "items": [
        {
          "id": "act1",
          "org": "Lakeshore Analytics Club",
          "role": "Member",
          "location": "Columbus, OH",
          "start": "2024-01",
          "end": "present",
          "evidence": [
            {
              "src": "orig",
              "ref": "R26-R27"
            }
          ],
          "bullets": [
            {
              "id": "act1.b1",
              "text": "Helped organize 2 Excel workshops for first-year students",
              "evidence": [
                {
                  "src": "orig",
                  "ref": "R28",
                  "quote": "Helped organize 2 Excel workshops for first-year students"
                }
              ],
              "ops": []
            }
          ]
        }
      ]
    },
    {
      "id": "skills",
      "type": "skills",
      "title": "Skills",
      "groups": [
        {
          "label": "Tools",
          "items": [
            "Excel (pivot tables, VLOOKUP)",
            "Google Sheets",
            "Canva",
            "Mailchimp"
          ],
          "evidence": [
            {
              "src": "orig",
              "ref": "R30"
            }
          ]
        },
        {
          "label": "Data",
          "items": [
            "SQL (class projects)",
            "Python (intro course)"
          ],
          "evidence": [
            {
              "src": "orig",
              "ref": "R31"
            }
          ]
        },
        {
          "label": "Languages",
          "items": [
            "English",
            "Spanish (conversational)"
          ],
          "evidence": [
            {
              "src": "orig",
              "ref": "R32"
            }
          ]
        }
      ]
    }
  ],
  "placeholders": {}
}
